{
    "initT": 298.15,
    "NegativeElectrode": {
        "electricalConductivity": 215,
        "heatCapacity": 4180000.0,
        "thermalConductivity": 6e-05,
        "InterDiffusionCoefficient": 1e-10,
        "chargeCarrierName": "Li",
        "Interface": {
            "isFile": true,
            "filename": "JsonDatas/Chen2020/chenNegativeElectrodeInterface.json"
        }
    },
    "PositiveElectrode": {
        "electricalConductivity": 0.18,
        "heatCapacity": 4180000.0,
        "thermalConductivity": 6e-05,
        "InterDiffusionCoefficient": 1e-10,
        "chargeCarrierName": "Li",
        "Interface": {
            "isFile": true,
            "filename": "JsonDatas/Chen2020/chenPositiveElectrodeInterface.json"
        }
    },
    "Electrolyte": {
        "filename": "JsonDatas/Chen2020/chenElectrolyte.json",
        "isFile": true
    }
}
